{
  "schemaVersion": "avalaos-full-platform-campaign/v1",
  "campaignId": "avalaos-full-platform-synthetic-v1",
  "status": "planned_verification",
  "canonicalCatalogSource": "tests/acceptance/catalog/test-catalog.json",
  "canonicalInventorySource": "tests/acceptance/inventory.json",
  "canonicalProvenanceSource": "tests/acceptance/source-provenance.json",
  "canonicalExecutionBindingsSource": "tests/acceptance/execution-bindings.json",
  "visibleViewSource": "types.ts",
  "personaSource": "data/mockData.ts",
  "outputRoot": "output/full-platform",
  "trackedDefinitionRoot": "testing/full-platform",
  "requiredCounts": {
    "visibleViews": 24,
    "catalogCases": 108,
    "catalogBranches": 108,
    "personas": 7,
    "organizations": 2,
    "workspaces": 2
  },
  "entryGates": [
    "exact checked-out head recorded at execution time",
    "working-tree hygiene inspected without touching unrelated user state",
    "canonical catalog, provenance, proof-owner, and execution bindings validate",
    "local/disposable infrastructure only unless separately authorized",
    "synthetic fixture identifiers selected before mutation",
    "provider simulations pass before any paid request",
    "provider model and request/token/cost ceilings explicitly approved before live calls",
    "server-only ignored key files pass presence and naming checks without value disclosure"
  ],
  "evidenceRules": {
    "catalogMembershipIsExecutionProof": false,
    "suiteSuccessSynthesizesExactTestPass": false,
    "uiVisibilityProvesServerAuthority": false,
    "plannedScopeMayProducePass": false,
    "compositeEvidenceMayOmitComponent": false,
    "exactHeadRequired": true,
    "exactRunAttemptRequired": true,
    "canonicalCommandRequired": true,
    "tenantWorkspaceBindingRequired": true,
    "sanitizedOutputsOnly": true
  },
  "requiredDevices": [
    "desktop-chromium",
    "pixel-7-chromium"
  ],
  "resultVocabulary": [
    "executed evidence",
    "planned verification",
    "blocked",
    "not run",
    "confirmed source defect",
    "suspected defect requiring deeper validation",
    "deployment status unknown"
  ],
  "nonClaims": [
    "deployment",
    "hosted-live validation",
    "pilot readiness",
    "production readiness",
    "buyer acceptance",
    "security certification",
    "compliance certification",
    "permission to merge",
    "permission to mark PR #255 Ready"
  ],
  "rollbackDocument": "testing/full-platform/cleanup-and-rollback.md"
}
